{
  "system_name": "Databricks Mosaic AI Gateway",
  "vendor": "Databricks",
  "description": "Centralized model serving gateway for internally hosted and fine-tuned models on Databricks platform",
  "D": 0, "T": 0, "A": 0,
  "tier": "Tier A",
  "justification": {
    "D_rationale": "D=0: When serving internally trained/fine-tuned models, the organization has full control over training data, inference data, and the serving infrastructure within its Databricks workspace.",
    "T_rationale": "T=0: For internally trained models, the organization has full visibility into model architecture, weights, training process, and hyperparameters through the MLflow model registry.",
    "A_rationale": "A=0: The gateway serves model inference endpoints that respond only when explicitly invoked by application code. No autonomous behavior."
  },
  "edge_case_notes": "When Mosaic AI Gateway routes to external model APIs (e.g., OpenAI, Anthropic), those specific routes should be classified as Tier B. The gateway itself is Tier A infrastructure.",
  "last_updated": "2026-03-30",
  "contributor": "Aman Sharma (ORCID: 0009-0005-5107-4485)"
}
